"IdProd";"strNome";"strDescricao";"strNomeArq";"douPreco"
1;"iPhone 8 Plus";"iPhone 8 Plus 64GB Cinza Tela 5.5"" iOS 12 4G Câmera 12MP - Apple";"iphone8plu.jpg_4-4-2020-21128.jpg";2888.89
2;"Smartphone Motorola Moto G7";"Smartphone Motorola Moto G7 Play Edição Especial 32GB Dual Chip Android Pie - 9.0 Tela 5.7"" 1.8 GHz Octa-Core 4G Câmera 13MP - Índigo";"MotorolaMo.jpg_4-4-2020-21556.jpg";836.07
3;"Smartphone LG K12 Prime";"Smartphone LG K12 Prime 64GB Dual Chip Android 9.0 (Pie) Tela 6.2"" Octa Core 2.0GHz 4G Câmera 16MP+2MP+W5MP - Preto";"Smartphone.jpg_4-4-2020-21714.jpg";826.77
4;"Smartphone Xiaomi Redmi Note 8";"Smartphone Xiaomi Redmi Note 8";"Smartphone.jfif_4-4-2020-21848.jfif";1600.0
5;"indica Smartphone Samsung Galaxy S9 Dual";"indica Smartphone Samsung Galaxy S9 Dual Chip Android 8.0 Tela 5.8"" Octa-Core 2.8GHz 128GB 4G Câmera 12MP - Preto";"SamasungGa.png_4-4-2020-211010.png";1709.35
6;"Smartphone Multilaser MS80X";"Smartphone Multilaser MS80X 4G Android 8.1 Qualcomm 4GB RAM e 64GB Tela 6,2""HD Câm Traseira 12MP+5MP Cam Frontal 16MP Preto - NB743";"multilaser.jpg_4-4-2020-211144.jpg";1051.2
